{
  "schema_version": "2.0",
  "roadmap_slug": "rabbitmq-exchanges",
  "theme": "Exchanges no RabbitMQ",
  "background": "Roadmap em pt-BR para pessoa com conhecimento básico a intermediário de RabbitMQ, experiência prévia em aplicações reais e necessidade de reconstruir fundamentos com precisão.",
  "research_date": "2026-06-08",
  "assumptions": [
    "O recorte principal usa RabbitMQ 4.3 e o modelo AMQP 0-9-1, porque o tema pedido é exchanges, bindings, routing keys, filas, produtores e consumidores.",
    "A pessoa já conhece noções de mensageria; por isso o básico é conceitual e direto, sem tratar o leitor como iniciante absoluto.",
    "Pedidos de validação foram convertidos em perguntas de checagem, critérios de domínio e cenários conceituais, pois este workflow de roadmap não gera prática guiada."
  ],
  "limits": [
    "Não cobre implementação por linguagem, comandos operacionais, setup local, UI de management ou configuração passo a passo.",
    "Streams aparecem apenas como destino possível citado pela documentação de exchanges; o foco permanece em filas AMQP 0-9-1.",
    "Tipos especializados, federation e quorum queues entram somente como fronteiras avançadas ligadas a exchanges, não como guias completos desses temas.",
    "Garantias de entrega dependem de fila, durabilidade, persistência da mensagem, confirms, acks e configuração; nenhuma exchange isoladamente garante processamento pelo consumidor."
  ],
  "expected_understanding": "Ao final, a pessoa deve conseguir explicar qual problema uma exchange resolve, como produtores, bindings, routing keys, filas e consumidores trabalham juntos, como escolher default/direct/fanout/topic/headers, como diferenciar AE de DLX, e quais decisões afetam broadcast, consumo concorrente, retry, diagnóstico e governança de topologia.",
  "sources": [
    {
      "id": "F1",
      "url": "https://www.rabbitmq.com/docs/exchanges",
      "type": "documentação oficial RabbitMQ 4.3",
      "reason": "Define exchanges, tipos, bindings, exchange padrão, propriedades, E2E e alternate exchanges na documentação corrente.",
      "supports_nodes": [
        "basico/01-modelo-amqp-e-papel-da-exchange",
        "basico/02-exchange-padrao-e-publicacao-direta-aparente",
        "basico/03-bindings-routing-key-e-destinos",
        "basico/04-direct-fanout-e-topic",
        "basico/05-headers-e-metadados-de-roteamento",
        "intermediario/01-contrato-de-topologia-e-roteamento",
        "intermediario/02-broadcast-vs-consumidores-competindo",
        "intermediario/03-unroutable-mandatory-e-alternate-exchange",
        "intermediario/05-policies-x-arguments-e-permissoes",
        "intermediario/06-exchange-to-exchange-bindings",
        "intermediario/07-publisher-confirms-e-confiabilidade",
        "avancado/02-tipos-especializados-e-plugins",
        "avancado/05-governanca-e-limites-de-complexidade"
      ],
      "limits": "Documento da versão 4.3; tipos de exchange fornecidos por plugins devem ser conferidos na página própria do tipo ou plugin."
    },
    {
      "id": "F2",
      "url": "https://www.rabbitmq.com/tutorials/amqp-concepts",
      "type": "guia oficial RabbitMQ 4.3",
      "reason": "Explica o modelo AMQP 0-9-1: publishers, exchanges, bindings, queues, consumers e os quatro tipos clássicos.",
      "supports_nodes": [
        "basico/01-modelo-amqp-e-papel-da-exchange",
        "basico/02-exchange-padrao-e-publicacao-direta-aparente",
        "basico/03-bindings-routing-key-e-destinos",
        "basico/04-direct-fanout-e-topic",
        "basico/05-headers-e-metadados-de-roteamento"
      ],
      "limits": "É um guia conceitual; detalhes de operação e falhas usam páginas específicas."
    },
    {
      "id": "F3",
      "url": "https://www.rabbitmq.com/docs/publishers",
      "type": "documentação oficial RabbitMQ 4.3",
      "reason": "Explica publicação em exchanges, mensagens sem rota, mandatory flag, alternate exchange e erro ao publicar em exchange inexistente.",
      "supports_nodes": [
        "intermediario/01-contrato-de-topologia-e-roteamento",
        "intermediario/03-unroutable-mandatory-e-alternate-exchange",
        "intermediario/07-publisher-confirms-e-confiabilidade",
        "avancado/01-diagnostico-de-roteamento-e-observabilidade"
      ],
      "limits": "Foca publicadores; consumo e fila entram por fontes específicas."
    },
    {
      "id": "F4",
      "url": "https://www.rabbitmq.com/docs/queues",
      "type": "documentação oficial RabbitMQ 4.3",
      "reason": "Define filas como coleção ordenada que armazena mensagens e entrega para consumidores.",
      "supports_nodes": [
        "basico/06-filas-consumidores-e-entrega",
        "intermediario/02-broadcast-vs-consumidores-competindo"
      ],
      "limits": "Cobertura ampla de filas; o roadmap usa apenas o que esclarece a relação com exchanges."
    },
    {
      "id": "F5",
      "url": "https://www.rabbitmq.com/docs/consumers",
      "type": "documentação oficial RabbitMQ 4.3",
      "reason": "Define consumidores como aplicações ou subscriptions que consomem e reconhecem mensagens a partir de filas.",
      "supports_nodes": [
        "basico/06-filas-consumidores-e-entrega",
        "intermediario/02-broadcast-vs-consumidores-competindo",
        "avancado/01-diagnostico-de-roteamento-e-observabilidade"
      ],
      "limits": "Não é um guia de consumers completo neste roadmap; usado para separar fila, consumidor e exchange."
    },
    {
      "id": "F6",
      "url": "https://www.rabbitmq.com/docs/confirms",
      "type": "documentação oficial RabbitMQ 4.3",
      "reason": "Distingue acknowledgements de consumidores, negative acknowledgements, requeue, dead-letter e publisher confirms.",
      "supports_nodes": [
        "basico/06-filas-consumidores-e-entrega",
        "intermediario/02-broadcast-vs-consumidores-competindo",
        "intermediario/04-dead-letter-exchanges-e-retry-conceitual",
        "intermediario/07-publisher-confirms-e-confiabilidade",
        "avancado/03-quorum-queues-dlx-e-redelivery-limits"
      ],
      "limits": "Confirms provam aceitação pelo broker segundo as regras descritas, não processamento final pelo consumidor."
    },
    {
      "id": "F7",
      "url": "https://www.rabbitmq.com/docs/dlx",
      "type": "documentação oficial RabbitMQ 4.3",
      "reason": "Define Dead Letter Exchanges, eventos de dead-lettering, policy keys e recomendações contra x-arguments rígidos.",
      "supports_nodes": [
        "intermediario/04-dead-letter-exchanges-e-retry-conceitual",
        "intermediario/05-policies-x-arguments-e-permissoes",
        "avancado/01-diagnostico-de-roteamento-e-observabilidade",
        "avancado/03-quorum-queues-dlx-e-redelivery-limits"
      ],
      "limits": "DLX é exchange normal usada por filas; garantias mais fortes com quorum queues dependem de configuração específica."
    },
    {
      "id": "F8",
      "url": "https://www.rabbitmq.com/docs/ae",
      "type": "documentação oficial RabbitMQ 4.3",
      "reason": "Explica Alternate Exchanges para mensagens que a exchange principal não conseguiu rotear e ressalva a exchange padrão.",
      "supports_nodes": [
        "intermediario/03-unroutable-mandatory-e-alternate-exchange",
        "avancado/01-diagnostico-de-roteamento-e-observabilidade"
      ],
      "limits": "AE não se aplica à exchange padrão em versões modernas segundo a documentação."
    },
    {
      "id": "F9",
      "url": "https://www.rabbitmq.com/docs/e2e",
      "type": "documentação oficial RabbitMQ 4.3",
      "reason": "Explica bindings exchange-to-exchange, direção source -> destination, ciclos e uma cópia por fila em topologias transitivas.",
      "supports_nodes": [
        "intermediario/06-exchange-to-exchange-bindings",
        "avancado/04-federated-exchanges-e-wan"
      ],
      "limits": "É uma extensão RabbitMQ para AMQP 0-9-1; não trate como republicação comum."
    },
    {
      "id": "F10",
      "url": "https://www.rabbitmq.com/docs/policies",
      "type": "documentação oficial RabbitMQ 4.3",
      "reason": "Define policies como mecanismo declarativo por vhost para parâmetros de queues, streams, exchanges e plugins que mudam em runtime.",
      "supports_nodes": [
        "intermediario/05-policies-x-arguments-e-permissoes",
        "avancado/04-federated-exchanges-e-wan",
        "avancado/05-governanca-e-limites-de-complexidade"
      ],
      "limits": "Nem todo argumento pode ser policy; queue type, por exemplo, é decidido na declaração."
    },
    {
      "id": "F11",
      "url": "https://www.rabbitmq.com/docs/access-control",
      "type": "documentação oficial RabbitMQ 4.3",
      "reason": "Sustenta separação de vhosts, autenticação, autorização e permissões de recursos.",
      "supports_nodes": [
        "intermediario/05-policies-x-arguments-e-permissoes",
        "avancado/05-governanca-e-limites-de-complexidade"
      ],
      "limits": "Usada para governança e fronteiras de publicação, não como guia completo de segurança."
    },
    {
      "id": "F12",
      "url": "https://www.rabbitmq.com/docs/quorum-queues",
      "type": "documentação oficial RabbitMQ 4.3",
      "reason": "Cobre delivery-limit, redelivery loops, delayed retry e dead-lettering em quorum queues.",
      "supports_nodes": [
        "intermediario/04-dead-letter-exchanges-e-retry-conceitual",
        "avancado/03-quorum-queues-dlx-e-redelivery-limits"
      ],
      "limits": "Aplicável quando a fila é quorum; não generalize para todos os tipos de fila sem verificar."
    },
    {
      "id": "F13",
      "url": "https://www.rabbitmq.com/docs/local-random-exchange",
      "type": "documentação oficial RabbitMQ 4.3",
      "reason": "Define Local Random Exchange para request-reply de baixa latência com filas locais e exclusivas.",
      "supports_nodes": [
        "avancado/02-tipos-especializados-e-plugins"
      ],